StartDate,EndDate,Status,IPAddress,Progress,Duration (in seconds),Finished,RecordedDate,ResponseId,RecipientLastName,RecipientFirstName,RecipientEmail,ExternalReference,LocationLatitude,LocationLongitude,DistributionChannel,UserLanguage,Q112,Q98,Q99,name,date_one_days,date_one_weeks,date_one_months,Need for Cognition_1,Need for Cognition_2,Need for Cognition_3,Need for Cognition_4,Need for Cognition_5,Need for Cognition_6,Need for Cognition_7,Need for Cognition_8,Need for Cognition_9,Need for Cognition_10,Cog Reflection 1,Cog Reflection 2,Cog Reflection 3,Self Control Scale_1,Self Control Scale_2,Self Control Scale_3,Self Control Scale_4,Self Control Scale_5,Self Control Scale_6,Self Control Scale_7,Self Control Scale_8,Self Control Scale_9,Self Control Scale_10,Self Control Scale_11,Self Control Scale_12,Self Control Scale_13,Perceived Stress_1,Perceived Stress_2,Perceived Stress_3,Perceived Stress_4,Subjective Wellbeing_1,Subjective Wellbeing_2,Subjective Wellbeing_3,Health,Early-Life Unpredict_1,Early-Life Unpredict_2,Early-Life Unpredict_3,Early-Life Harshness_1,Early-Life Harshness_2,Early-Life Harshness_3,Early-Life Harshness_4,Attachment Style_1,Attachment Style_2,Attachment Style_3,Attachment Style_4,Attachment Style_5,Attachment Style_6,Attachment Style_7,Attachment Style_8,Attachment Style_9,Attachment Style_10,Attachment Style_11,Attachment Style_12,Destiny v Growth_1,Destiny v Growth_2,Destiny v Growth_3,Destiny v Growth_4,Destiny v Growth_5,Destiny v Growth_6,Destiny v Growth_7,Destiny v Growth_8,Delib Decis Style_1,Delib Decis Style_2,Delib Decis Style_3,Delib Decis Style_4,Delib Decis Style_5,Delib Decis Style_6,Sexpectations_1,Sexpectations_2,Sexpectations_3,Sexpectations_4,Sexpectations_5,Sexpectations_6,Sexpectations_7,Sexpectations_8,Sexpectations_9,Sexpectations_10,Fear of Being Single_1,Fear of Being Single_2,Fear of Being Single_3,Fear of Being Single_4,Fear of Being Single_5,Fear of Being Single_6,Sociosex Orientate1,Sociosex Orientate2,Sociosex Orientate3,Sociosex Orientat4-6_1,Sociosex Orientat4-6_2,Sociosex Orientat4-6_3,Sociosex Orientate7,Sociosex Orientate8,Sociosex Orientate9,Sex Drive_1,Sex Drive_2,sex_importance,Mating Strategies_1,Mating Strategies_2,Mating Strategies_3,Slf-Perc Mate Val_1,Slf-Perc Mate Val_2,Slf-Perc Mate Val_3,Date History 1,Date History 2,Date History 3,Dating Ideals_1,Dating Ideals_2,Dating Ideals_3,Dating Ideals_4,Dating Ideals 5-8_1,Dating Ideals 5-8_2,Dating Ideals 5-8_3,Dating Ideals 5-8_4,Dating Expectations_1,Dating Expectations_2,Dating Expectations_3,Dating Expectations_4,Dating Expectate 5-8_1,Dating Expectate 5-8_2,Dating Expectate 5-8_3,Dating Expectate 5-8_4,told_friends_rel,exclusive,met_friends,introduced_to_friend,post_on_socials,met_parents,met_your_parents,say_love,facebook_rel,have_sex,spent_night,novel_activity,future_activity,overnight_trip,moved_in,talk_marriage,major_purchas,engaged,married,Attach Feat & Funct_1,Attach Feat & Funct_2,Attach Feat & Funct_3,Attach Feat & Funct_4,Attach Feat & Funct_5,Attach Feat & Funct_6,Attach Feat & Funct_7,Attach Feat & Funct_8,intimacy_1,intimacy_2,intimacy_3,intimacy_4,intimacy_5,intimacy_6,intimacy_7,intimacy_8,Sexual Frequency,Sexual Frequency_1_TEXT,Sex Des Ideal & SatB_1,Sex Des Ideal & SatB_2,Sex Des Ideal & SatB_3,Sex Des Ideal & SatC_1,Sex Des Ideal & SatC_2,Sex Des Ideal & SatC_3,Sex Des Ideal & SatC_4,Sex Des Ideal & SatC_5,Sex Des Ideal & SatA_1,Sex Des Ideal & SatA_2,Sex Des Ideal & SatA_3,Passion/Comp Love_1,Passion/Comp Love_2,Passion/Comp Love_3,Passion/Comp Love_4,Passion/Comp Love_5,Passion/Comp Love_6,Passion/Comp Love_7,Passion/Comp Love_8,Passion/Comp Love_9,invests_1,invests_2,invests_3,invests_4,invests_5,invests_6,invests_7,invests_8,Forecast Rel Qual_1,Forecast Rel Qual_2,Forecast Rel Qual_3,Forecast Rel Qual_4,Forecast Rel Qual_5,Forecast Rel Qual_6,Forecast Rel Qual_7,Anticipated Compat_1,Anticipated Compat_2,Anticipated Compat_3,Perceived Sim: Gen_1,Perceived Sim: Gen_2,Perceived Sim: Gen_3,Perceived Sim: Gen_4,Perceived Traits_1,Perceived Traits_2,Perceived Traits_3,Perceived Traits_4,Perceived Traits_5,Perceived Traits_6,Perceived Traits_7,Perceived Traits_8,Perceived Traits_9,Soc Network Supp1,Soc Network Supp2,Prcv Partner Respons_1,Prcv Partner Respons_2,Prcv Partner Respons_3,Prcv Partner Respons_4,Prcv Partner Respons_5,Prcv Partner Respons_6,Prcv Partner Respons_7,Prcv Partner Respons_8,Prcv Partner Respons_9,Prcv Partner Respons_10,Prcv Partner Respons_11,Prcv Partner Respons_12,Prcv Goal Congruence_1,Prcv Goal Congruence_2,Prcv Goal Congruence_3,Prcv Goal Congruence_4,Prcv Goal Congruence_5,sat_1,sat_2,sat_3,sat_4,sat_5,alt_1,alt_2,alt_3,alt_4,alt_5,inv_1,inv_2,inv_3,inv_4,inv_5,commit_1,commit_2,commit_3,commit_4,commit_5,commit_6,commit_7,partnerinv_1,partnerinv_2,partnerinv_3,partnerinv_4,partnerinv_5,partnercommit_1,partnercommit_2,partnercommit_3,partnercommit_4,Age,Partner Age,Gender,Partner Gender,Sexual Exclusivity,Emotional Exclusivit,instagram_yn,instagram_handle,instagram_handle_1_TEXT,Race,Nationality,Native English,Religion,Religion_9_TEXT,Religious Involvemen,Political Involvemen,Education,Children,Number of Children,Divorced Parents,Education (Mom),Education (Dad),Occupation (Mom),Occupation (Dad),Survey Honesty,Additional Comments,Survey Honesty2,Survey Honesty2_2_TEXT,Race - Topics
Start Date,End Date,Response Type,IP Address,Progress,Duration (in seconds),Finished,Recorded Date,Response ID,Recipient Last Name,Recipient First Name,Recipient Email,External Data Reference,Location Latitude,Location Longitude,Distribution Channel,User Language,.,"I will complete this online questionnaire by
myself – with nobody else looking on. (If there are other people looking at the
computer with you right now, please make sure that they have left before you
click ""agree"").","I will answer the questions as openly and as
honestly as I can.","What name would you like us to use to refer to your new dating partner?

You can provide a first name, a nickname, initials, or anything else that represents this person to you.",Approximately how many DAYS AGO was your first date with [QID133-ChoiceTextEntryValue]?,Approximately how many WEEKS AGO was your first date with [QID133-ChoiceTextEntryValue]?,Approximately how many MONTHS AGO was your first date with [QID133-ChoiceTextEntryValue]?,"For each of the following statements, select the option that best describes you. - I would prefer complex to simple problems.","For each of the following statements, select the option that best describes you. - Thinking is not my idea of fun.","For each of the following statements, select the option that best describes you. - I prefer to think about small, daily projects to long-term ones.","For each of the following statements, select the option that best describes you. - I like tasks that require little thought once I’ve learned them.","For each of the following statements, select the option that best describes you. - I really enjoy a task that involves coming up with new solutions to problems.","For each of the following statements, select the option that best describes you. - Learning new ways to think doesn’t excite me very much.","For each of the following statements, select the option that best describes you. - I prefer my life to be filled with puzzles that I must solve.","For each of the following statements, select the option that best describes you. - The notion of thinking abstractly is appealing to me.","For each of the following statements, select the option that best describes you. - I feel relief rather than satisfaction after completing a task that required a lot of mental effort.","For each of the following statements, select the option that best describes you. - It’s enough for me that something gets the job done; I don’t care how or why it works.",A hotdog and a coke cost $3.50 in total. The hotdog costs three dollars more than thecoke. How much does the coke cost? ____ cents,"If it takes 10 people 10 minutes to assemble 10 office chairs, how many minutes would it take 100 people to assemble 100 office chairs? ____ minutes.","In a forest, there is a patch of moss. Every day, the patch doubles in size. If it takes 64 days for the patch to cover the entire forest, how many days would it take the patch to cover half the forest? ____ days.","For each of the following statements, select the option that best describes you. - I am good at resisting temptation","For each of the following statements, select the option that best describes you. - I have a hard time breaking bad habits","For each of the following statements, select the option that best describes you. - I am lazy","For each of the following statements, select the option that best describes you. - I say inappropriate things","For each of the following statements, select the option that best describes you. - I do certain things that are bad for me, if they are fun","For each of the following statements, select the option that best describes you. - I refuse things that are bad for me","For each of the following statements, select the option that best describes you. - I wish I had more self-discipline","For each of the following statements, select the option that best describes you. - People would say that I have iron self-discipline","For each of the following statements, select the option that best describes you. - Pleasure and fun sometimes keep me from getting work done","For each of the following statements, select the option that best describes you. - I have trouble concentrating","For each of the following statements, select the option that best describes you. - I am able to work effectively toward long-term goals","For each of the following statements, select the option that best describes you. - Sometimes I can’t stop myself from doing something, even if I know it is wrong","For each of the following statements, select the option that best describes you. - I often act without thinking through all the alternatives","For each of the following statements, select the option that best describes you. - In the last month, how often have you felt that you were unable to control the important things in your life?","For each of the following statements, select the option that best describes you. - In the last month, how often have you felt confident about your ability to handle your personal problems?","For each of the following statements, select the option that best describes you. - In the last month, how often have you felt that things were going your way?","For each of the following statements, select the option that best describes you. - In the last month, how often have you felt difficulties were piling up so high that you could not overcome them?","For each of the following statements, select the option that best describes you. - In most ways, my life is close to ideal","For each of the following statements, select the option that best describes you. - I am satisfied with my life","For each of the following statements, select the option that best describes you. - If I could live my life over, I would change almost everything","In general, how would you describe your health?","For each of the following statements, select the option that best describes you. - In your early childhood, did your parents or legal guardians change jobs or occupational status?","For each of the following statements, select the option that best describes you. - In your early childhood, were there changes to your place of residence?","For each of the following statements, select the option that best describes you. - In your early childhood, were there changes in your familial circumstances (divorce or separation of parents, parents starting new romantic relationships, parents leaving the home, etc.)?","For each of the following statements, select the option that best describes you. - My family usually had enough money for things when I was growing up.","For each of the following statements, select the option that best describes you. - I grew up in a relatively wealthy neighborhood.","For each of the following statements, select the option that best describes you. - I felt relatively wealthy compared with the other kids in my school.","For each of the following statements, select the option that best describes you. - My family struggled financially while I was growing up.","For each of the following statements, select the option that best describes you. - It helps to turn to my romantic partner in times of need.","For each of the following statements, select the option that best describes you. - I need a lot of reassurance that I am loved by my partner.","For each of the following statements, select the option that best describes you. - I want to get close to my partner, but I keep pulling back.","For each of the following statements, select the option that best describes you. - I find that my partner(s) don’t want to get as close as I would like.","For each of the following statements, select the option that best describes you. - I turn to my partner for many things, including comfort and reassurance.","For each of the following statements, select the option that best describes you. - My desire to be very close sometimes scares people away.","For each of the following statements, select the option that best describes you. - I try to avoid getting too close to my partner.","For each of the following statements, select the option that best describes you. - I do not often worry about being abandoned.","For each of the following statements, select the option that best describes you. - I usually discuss my problems and concerns with my partner.","For each of the following statements, select the option that best describes you. - I get frustrated if romantic partners are not available when I need them.","For each of the following statements, select the option that best describes you. - I am nervous when partners get too close to me.","For each of the following statements, select the option that best describes you. - I worry that romantic partners won’t care about me as much as I care about them.",Please rate the following items using the scale below: - Potential relationship partners are either compatible or they are not.,Please rate the following items using the scale below: - A successful relationship evolves through hard work and resolution of incompatibilities.,Please rate the following items using the scale below: - Potential relationship partners are either destined to get along or they are not.,Please rate the following items using the scale below: - It takes a lot of time and effort to cultivate a good relationship.,Please rate the following items using the scale below: - The success of a potential relationship is destined from the very beginning.,Please rate the following items using the scale below: - Challenges and obstacles in a relationship can make love even stronger.,"Please rate the following items using the scale below: - To last, a relationship must seem right from the start.",Please rate the following items using the scale below: - Problems in a relationship can bring partners closer together.,When I make decisions about dating and romantic relationships: - Developing a clear plan is very important to me,When I make decisions about dating and romantic relationships: - I tend to weigh out all the pros and cons,When I make decisions about dating and romantic relationships: - I take the time to think things through,"When I make decisions about dating and romantic relationships: - Before making a decision, I usually think about the goals I want to achieve",When I make decisions about dating and romantic relationships: - I prefer making detailed plans rather than leaving things to chance,"When I make decisions about dating and romantic relationships: - I usually have clear, explainable reasons for my decisions",Please rate the following items using the scale below: - A couple is either destined to have a satisfying sex life or they are not.,"Please rate the following items using the scale below: - In a relationship, maintaining a satisfying sex life requires effort.",Please rate the following items using the scale below: - Struggles in a sexual relationship are a sure sign that the relationship will fail.,Please rate the following items using the scale below: - Successful sexual relationships require regular maintenance.,Please rate the following items using the scale below: - Troubles in a sexual relationship signify a poor match between partners.,Please rate the following items using the scale below: - Communicating about sexual issues can bring partners closer together.,Please rate the following items using the scale below: - Experiencing sexual problems is a sure sign that a couple is not sexually compatible.,Please rate the following items using the scale below: - Acknowledging each other’s differing sexual interests is important for a couple to enhance their sex life.,Please rate the following items using the scale below: - An unsatisfying sex life suggests that the relationship was never meant to be.,"Please rate the following items using the scale below: - In order to maintain a good sexual relationship, a couple needs to exert time and energy.","For each of the following statements, select the option that best describes you. - It scares me to think that there might not be anyone out there for me.","For each of the following statements, select the option that best describes you. - I feel it is close to being too late for me to find the love of my life.","For each of the following statements, select the option that best describes you. - I feel anxious when I think about being single forever.","For each of the following statements, select the option that best describes you. - I need to find a partner before I’m too old to have and raise children.","For each of the following statements, select the option that best describes you. - If I end up alone in life, I will probably feel like there is something wrong with me.","For each of the following statements, select the option that best describes you. - As I get older, it will get harder and harder to find someone.",With how many different partners have you had sex within the past 12 months?,With how many different partners have you had sexual intercourse on one and only one occasion?,With how many different partners have you had sexual intercourse without having an interest in a long-term committed relationship with this person?,"For each of the following statements, select the option that best describes your beliefs. - Sex without love is OK.","For each of the following statements, select the option that best describes your beliefs. - I can imagine myself being comfortable and enjoying ""casual"" sex with different partners.","For each of the following statements, select the option that best describes your beliefs. - I do not want to have sex with a person until I am sure that we will have a long-term, serious relationship.",How often do you have fantasies about having sex with someone you are not in a committed romantic relationship with?,How often do you experience sexual arousal when you are in contact with someone you are not in a committed romantic relationship with?,"In everyday life, how often do you have spontaneous fantasies about having sex with someone you have just met?","For each of the following statements, select the option that best describes you. - I have a strong sex drive.","For each of the following statements, select the option that best describes you. - I experience sexual desire extremely frequently.",How important is sex to you?,"For each of the following statements, select the option that best describes you. - My romantic relationships are nearly always committed and serious.","For each of the following statements, select the option that best describes you. - In considering possible romantic partners, I typically think about their ""long-term"" potential.","For each of the following statements, select the option that best describes you. - I prefer a long-term relationship with one partner.","For each of the following statements, select the option that best describes you. - I am a desirable dating partner.","For each of the following statements, select the option that best describes you. - In general, I tend to have many options for romantic partners.","For each of the following statements, select the option that best describes you. - Members of the opposite sex that I like tend to like me back","In your life, with approximately how many people have you had a dating relationship that lasted at least three months?",How long has it been (in months) since your most recent relationship that lasted more than three months ended?,"How long has it been since you last had any romantic physical contact (e.g., kissing) or sexual contact with someone? Answer in days (take your best guess):","For a person to be your IDEAL romantic partner:
How important is it that they have each of the following traits? - Warm","For a person to be your IDEAL romantic partner:
How important is it that they have each of the following traits? - Responsive to my needs","For a person to be your IDEAL romantic partner:
How important is it that they have each of the following traits? - Open & disclosing","For a person to be your IDEAL romantic partner:
How important is it that they have each of the following traits? - Kind & affectionate","For a person to be your IDEAL romantic partner:
How important is it that they have each of the following traits? - Controlling & dominant","For a person to be your IDEAL romantic partner:
How important is it that they have each of the following traits? - Complaining","For a person to be your IDEAL romantic partner:
How important is it that they have each of the following traits? - Irrational","For a person to be your IDEAL romantic partner:
How important is it that they have each of the following traits? - Critical & judgmental",How rare do you think it is to find a romantic partner who has each of the following traits? - Warm,How rare do you think it is to find a romantic partner who has each of the following traits? - Responsive to my needs,How rare do you think it is to find a romantic partner who has each of the following traits? - Open & disclosing,How rare do you think it is to find a romantic partner who has each of the following traits? - Kind & affectionate,How rare do you think it is to find a romantic partner who does NOT have each of the following traits? - Controlling & dominant,How rare do you think it is to find a romantic partner who does NOT have each of the following traits? - Complaining,How rare do you think it is to find a romantic partner who does NOT have each of the following traits? - Irrational,How rare do you think it is to find a romantic partner who does NOT have each of the following traits? - Critical & judgmental,Told friends about your relationship?,"Become exclusive with [QID133-ChoiceTextEntryValue] (i.e., not dating other people)?",Met [QID133-ChoiceTextEntryValue]’s friends?,Introduced [QID133-ChoiceTextEntryValue] to your friends?,Posted a photo of yourself with [QID133-ChoiceTextEntryValue] on social media?,Met [QID133-ChoiceTextEntryValue]’s parents?,Introduced [QID133-ChoiceTextEntryValue] to your parents?,Said “I love you” to [QID133-ChoiceTextEntryValue]?,"Set your relationship status to ""in a relationship"" on Facebook?",Become sexually intimate with [QID133-ChoiceTextEntryValue]?,Spent the night together with [QID133-ChoiceTextEntryValue]?,Tried a novel activity with [QID133-ChoiceTextEntryValue] (something one or both of you has never done before)?,"Planned a future activity with [QID133-ChoiceTextEntryValue] more than 1 month in advance (e.g., vacation, concert)?",Taken an overnight trip with [QID133-ChoiceTextEntryValue]?,Moved in with [QID133-ChoiceTextEntryValue]?,Discussed the possibility of marriage with [QID133-ChoiceTextEntryValue]?,"Made a major purchase with [QID133-ChoiceTextEntryValue] (e.g., pet, car, house cell phone plan)?",Become engaged to [QID133-ChoiceTextEntryValue]?,Married [QID133-ChoiceTextEntryValue]?,"Please take a moment to reflect on your new dating relationship with [QID133-ChoiceTextEntryValue]. Then, for each of the following statements, select the option that best describes you. - [QID133-ChoiceTextEntryValue] is the person that I would want to go to, to help me feel better when something bad happens to me or I feel upset.","Please take a moment to reflect on your new dating relationship with [QID133-ChoiceTextEntryValue]. Then, for each of the following statements, select the option that best describes you. - I make an effort to stay in contact with  [QID133-ChoiceTextEntryValue].","Please take a moment to reflect on your new dating relationship with [QID133-ChoiceTextEntryValue]. Then, for each of the following statements, select the option that best describes you. - If I achieved something good,  [QID133-ChoiceTextEntryValue] is the person that I would tell first.","Please take a moment to reflect on your new dating relationship with [QID133-ChoiceTextEntryValue]. Then, for each of the following statements, select the option that best describes you. - [QID133-ChoiceTextEntryValue] is the person that I would like to be able to count on to always be there for me and care about me no matter what.","Please take a moment to reflect on your new dating relationship with [QID133-ChoiceTextEntryValue]. Then, for each of the following statements, select the option that best describes you. - My life would be severely disrupted if  [QID133-ChoiceTextEntryValue] was no longer a part of it.","Please take a moment to reflect on your new dating relationship with [QID133-ChoiceTextEntryValue]. Then, for each of the following statements, select the option that best describes you. - [QID133-ChoiceTextEntryValue] is a person whom I count on for advice.","Please take a moment to reflect on your new dating relationship with [QID133-ChoiceTextEntryValue]. Then, for each of the following statements, select the option that best describes you. - [QID133-ChoiceTextEntryValue] is the first person that I think of when I have a problem.","Please take a moment to reflect on your new dating relationship with [QID133-ChoiceTextEntryValue]. Then, for each of the following statements, select the option that best describes you. - [QID133-ChoiceTextEntryValue] is the person that I would actually go to, to help me feel better when something bad happens to me or I feel upset.",intimacy - It is important to me to see or talk with  [QID133-ChoiceTextEntryValue] regularly.,intimacy - [QID133-ChoiceTextEntryValue] is a person whom I do not like to be away from.,intimacy - [QID133-ChoiceTextEntryValue] is the first person that I would turn to if I had a problem.,intimacy - [QID133-ChoiceTextEntryValue]'s death would have a great impact on me.,"intimacy - If  [QID133-ChoiceTextEntryValue] was no longer accessible to me, I would feel greatly distressed.",intimacy - [QID133-ChoiceTextEntryValue] is my primary source of emotional support.,"intimacy - When I am away from  [QID133-ChoiceTextEntryValue], I feel down.",intimacy - [QID133-ChoiceTextEntryValue] is the person that I would actually count on to always be there for me and care about me no matter what.,How many times have you engaged in sex with [QID133-ChoiceTextEntryValue]? - Selected Choice,How many times have you engaged in sex with [QID133-ChoiceTextEntryValue]? - Number of times: - Text,"For each of the following statements, select the option that best describes you. - It is hard for me to get in the mood for sex with  [QID133-ChoiceTextEntryValue].","For each of the following statements, select the option that best describes you. - I lack the desire necessary to pursue sex with  [QID133-ChoiceTextEntryValue].","For each of the following statements, select the option that best describes you. - [QID133-ChoiceTextEntryValue] is as close to ideal as a sexual partner as I ever expect to find.",Please rate your sex life on the following dimensions:,Please rate your sex life on the following dimensions:,Please rate your sex life on the following dimensions:,Please rate your sex life on the following dimensions:,Please rate your sex life on the following dimensions:,"For each of the following statements, select the option that best describes your dating relationship with [QID133-ChoiceTextEntryValue]. - I enjoy thinking about having sex with  [QID133-ChoiceTextEntryValue].","For each of the following statements, select the option that best describes your dating relationship with [QID133-ChoiceTextEntryValue]. - My desire for sex with  [QID133-ChoiceTextEntryValue] is strong.","For each of the following statements, select the option that best describes your dating relationship with [QID133-ChoiceTextEntryValue]. - [QID133-ChoiceTextEntryValue] is as close to ideal as a relationship partner as I ever expect to find.","For each of the following statements, select the option that best describes your dating relationship with [QID133-ChoiceTextEntryValue]. - I would feel deep despair if  [QID133-ChoiceTextEntryValue] left me.","For each of the following statements, select the option that best describes your dating relationship with [QID133-ChoiceTextEntryValue]. - Sometimes I feel I can’t control my thoughts; they are obsessively on  [QID133-ChoiceTextEntryValue].","For each of the following statements, select the option that best describes your dating relationship with [QID133-ChoiceTextEntryValue]. - I would rather be with  [QID133-ChoiceTextEntryValue] than with anyone else.","For each of the following statements, select the option that best describes your dating relationship with [QID133-ChoiceTextEntryValue]. - I’d get jealous if I thought  [QID133-ChoiceTextEntryValue] were falling in love with someone else.","For each of the following statements, select the option that best describes your dating relationship with [QID133-ChoiceTextEntryValue]. - I want  [QID133-ChoiceTextEntryValue]… physically, emotionally, mentally.","For each of the following statements, select the option that best describes your dating relationship with [QID133-ChoiceTextEntryValue]. - I have an endless appetite for affection from  [QID133-ChoiceTextEntryValue]","For each of the following statements, select the option that best describes your dating relationship with [QID133-ChoiceTextEntryValue]. - [QID133-ChoiceTextEntryValue] always seems to be on my mind.","For each of the following statements, select the option that best describes your dating relationship with [QID133-ChoiceTextEntryValue]. - I eagerly look for signs indicating  [QID133-ChoiceTextEntryValue]'s desire for me.","For each of the following statements, select the option that best describes your dating relationship with [QID133-ChoiceTextEntryValue]. - I possess a powerful attraction for  [QID133-ChoiceTextEntryValue].","For each of the following statements, select the option that best describes your dating relationship with [QID133-ChoiceTextEntryValue]. - I get extremely depressed when things don’t go right in my relationship with  [QID133-ChoiceTextEntryValue].","For each of the following statements, select the option that best describes your dating relationship with [QID133-ChoiceTextEntryValue]. - I feel that I can confide in  [QID133-ChoiceTextEntryValue] about virtually anything.","For each of the following statements, select the option that best describes your dating relationship with [QID133-ChoiceTextEntryValue]. - I find it easy to ignore  [QID133-ChoiceTextEntryValue]'s faults.","For each of the following statements, select the option that best describes your dating relationship with [QID133-ChoiceTextEntryValue]. - I would do almost anything for  [QID133-ChoiceTextEntryValue].","For each of the following statements, select the option that best describes your dating relationship with [QID133-ChoiceTextEntryValue]. - I would forgive  [QID133-ChoiceTextEntryValue] for practically anything.","For each of the following statements, select the option that best describes your dating relationship with [QID133-ChoiceTextEntryValue]. - I would greatly enjoy being confided in by  [QID133-ChoiceTextEntryValue].","For each of the following statements, select the option that best describes your dating relationship with [QID133-ChoiceTextEntryValue]. - I care about  [QID133-ChoiceTextEntryValue].","For each of the following statements, select the option that best describes your dating relationship with [QID133-ChoiceTextEntryValue]. - I feel that I can trust  [QID133-ChoiceTextEntryValue] completely.","For each of the following statements, select the option that best describes your dating relationship with [QID133-ChoiceTextEntryValue]. - I expect that our relationship has a good future","For each of the following statements, select the option that best describes your dating relationship with [QID133-ChoiceTextEntryValue]. - In the future I expect that my relationship with  [QID133-ChoiceTextEntryValue] will get worse","For each of the following statements, select the option that best describes your dating relationship with [QID133-ChoiceTextEntryValue]. - I expect that I will experience more problems in this relationship in the future","For each of the following statements, select the option that best describes your dating relationship with [QID133-ChoiceTextEntryValue]. - I expect that this relationship will go downhill in the future","For each of the following statements, select the option that best describes your dating relationship with [QID133-ChoiceTextEntryValue]. - I expect that I will be happy with this relationship in the future","For each of the following statements, select the option that best describes your dating relationship with [QID133-ChoiceTextEntryValue]. - In the future I expect that my relationship with  [QID133-ChoiceTextEntryValue] will get better","For each of the following statements, select the option that best describes your dating relationship with [QID133-ChoiceTextEntryValue]. - I expect that our sexual relationship has a good future","For each of the following statements, select the option that best describes your dating relationship with [QID133-ChoiceTextEntryValue]. - I believe that [QID133-ChoiceTextEntryValue] and I make a good long-term match.","For each of the following statements, select the option that best describes your dating relationship with [QID133-ChoiceTextEntryValue]. - I can see [QID133-ChoiceTextEntryValue] fitting in well with my future life plans.","For each of the following statements, select the option that best describes your dating relationship with [QID133-ChoiceTextEntryValue]. - I think that [QID133-ChoiceTextEntryValue] and I will remain compatible with each other far into the future.","For each of the following statements, select the option that best describes your dating relationship with [QID133-ChoiceTextEntryValue]. - [QID133-ChoiceTextEntryValue] and I have similar personalities.","For each of the following statements, select the option that best describes your dating relationship with [QID133-ChoiceTextEntryValue]. - [QID133-ChoiceTextEntryValue] and I have similar values.","For each of the following statements, select the option that best describes your dating relationship with [QID133-ChoiceTextEntryValue]. - [QID133-ChoiceTextEntryValue] and I have similar interests.","For each of the following statements, select the option that best describes your dating relationship with [QID133-ChoiceTextEntryValue]. - [QID133-ChoiceTextEntryValue] and I have a lot in common.",Please rate [QID133-ChoiceTextEntryValue] on the following traits. How well do these traits describe [QID133-ChoiceTextEntryValue]? - Warm,Please rate [QID133-ChoiceTextEntryValue] on the following traits. How well do these traits describe [QID133-ChoiceTextEntryValue]? - Moody,Please rate [QID133-ChoiceTextEntryValue] on the following traits. How well do these traits describe [QID133-ChoiceTextEntryValue]? - Controlling & dominant,Please rate [QID133-ChoiceTextEntryValue] on the following traits. How well do these traits describe [QID133-ChoiceTextEntryValue]? - Responsive to my needs,Please rate [QID133-ChoiceTextEntryValue] on the following traits. How well do these traits describe [QID133-ChoiceTextEntryValue]? - Complaining,Please rate [QID133-ChoiceTextEntryValue] on the following traits. How well do these traits describe [QID133-ChoiceTextEntryValue]? - Irrational,Please rate [QID133-ChoiceTextEntryValue] on the following traits. How well do these traits describe [QID133-ChoiceTextEntryValue]? - Open & disclosing,Please rate [QID133-ChoiceTextEntryValue] on the following traits. How well do these traits describe [QID133-ChoiceTextEntryValue]? - Critical & judgmental,Please rate [QID133-ChoiceTextEntryValue] on the following traits. How well do these traits describe [QID133-ChoiceTextEntryValue]? - Kind & affectionate,"Overall, how much actual discouragement or encouragement do you get from others to continue to date [QID133-ChoiceTextEntryValue]?","Overall, to what degree do you think others view you as a perfect couple that should marry someday?",[QID133-ChoiceTextEntryValue]: - Sees the “real” me.,[QID133-ChoiceTextEntryValue]: - “Gets the facts right” about me.,"[QID133-ChoiceTextEntryValue]: - Esteems me, shortcomings and all.",[QID133-ChoiceTextEntryValue]: - Knows me well.,[QID133-ChoiceTextEntryValue]: - Values and respects the whole package that is the “real” me.,[QID133-ChoiceTextEntryValue]: - Understands me.,[QID133-ChoiceTextEntryValue]: - Really listens to me.,[QID133-ChoiceTextEntryValue]: - Expresses liking and encouragement for me.,[QID133-ChoiceTextEntryValue]: - Seems interested in what I am thinking and feeling.,[QID133-ChoiceTextEntryValue]: - Values my abilities and opinions.,[QID133-ChoiceTextEntryValue]: - Is “on the same wavelength” with me.,[QID133-ChoiceTextEntryValue]: - Is responsive to my needs.,"For each of the following statements, select the option that best describes you. - I feel like [QID133-ChoiceTextEntryValue] and I are “on the same page” in terms of the goals we pursue together.","For each of the following statements, select the option that best describes you. - When it comes to pursing goals as a couple, I feel like [QID133-ChoiceTextEntryValue] and I are “of one mind”.","For each of the following statements, select the option that best describes you. - I’m confident that [QID133-ChoiceTextEntryValue] and I generally share the same goals for our relationship.","For each of the following statements, select the option that best describes you. - Sometimes I feel like my goals are incompatible with [QID133-ChoiceTextEntryValue]'s goals.","For each of the following statements, select the option that best describes you. - Making decisions with [QID133-ChoiceTextEntryValue] can be difficult because we have very different goals.","For each of the following statements, select the option that best describes your dating relationship with [QID133-ChoiceTextEntryValue]. - I feel satisfied with our relationship.","For each of the following statements, select the option that best describes your dating relationship with [QID133-ChoiceTextEntryValue]. - My relationship is much better than others’ relationships.","For each of the following statements, select the option that best describes your dating relationship with [QID133-ChoiceTextEntryValue]. - My relationship is close to ideal.","For each of the following statements, select the option that best describes your dating relationship with [QID133-ChoiceTextEntryValue]. - Our relationship makes me very happy.","For each of the following statements, select the option that best describes your dating relationship with [QID133-ChoiceTextEntryValue]. - Our relationship does a good job of fulfilling my needs for intimacy, companionship, etc.","For each of the following statements, select the option that best describes your dating relationship with [QID133-ChoiceTextEntryValue]. - The people other than  [QID133-ChoiceTextEntryValue] with whom I might become involved with are very appealing.","For each of the following statements, select the option that best describes your dating relationship with [QID133-ChoiceTextEntryValue]. - My alternatives to our relationship are close to ideal (dating another, spending time with friends or on my own, etc.)","For each of the following statements, select the option that best describes your dating relationship with [QID133-ChoiceTextEntryValue]. - If I weren’t with my dating partner, I would do fine- I’d find another appealing person to date.","For each of the following statements, select the option that best describes your dating relationship with [QID133-ChoiceTextEntryValue]. - My alternatives are attractive to me (dating another, spending time with friends or on my own, etc.)","For each of the following statements, select the option that best describes your dating relationship with [QID133-ChoiceTextEntryValue]. - My needs for intimacy, companionship, etc., could easily be fulfilled in an alternative relationship.","For each of the following statements, select the option that best describes your dating relationship with [QID133-ChoiceTextEntryValue]. - I have put a great deal into our relationship that I would lose if the relationship were to end.","For each of the following statements, select the option that best describes your dating relationship with [QID133-ChoiceTextEntryValue]. - Many aspects of my life have become linked to my partner (recreational activities, etc.) and I would lose all of this if we were to break up.","For each of the following statements, select the option that best describes your dating relationship with [QID133-ChoiceTextEntryValue]. - I feel very involved in our relationship- like I have put a great deal into it.","For each of the following statements, select the option that best describes your dating relationship with [QID133-ChoiceTextEntryValue]. - My relationships with friends and family members would be complicated if [QID133-ChoiceTextEntryValue] and I were to break up (e.g. [QID133-ChoiceTextEntryValue] is friends with people I care about).","For each of the following statements, select the option that best describes your dating relationship with [QID133-ChoiceTextEntryValue]. - Compared to other people I know, I have invested a great deal in my relationship with [QID133-ChoiceTextEntryValue].","For each of the following statements, select the option that best describes your dating relationship with [QID133-ChoiceTextEntryValue]. - I want our relationship to last a very long time.","For each of the following statements, select the option that best describes your dating relationship with [QID133-ChoiceTextEntryValue]. - I am committed to maintaining my relationship with  [QID133-ChoiceTextEntryValue].","For each of the following statements, select the option that best describes your dating relationship with [QID133-ChoiceTextEntryValue]. - I would not feel very upset if our relationship were to end in the near future.","For each of the following statements, select the option that best describes your dating relationship with [QID133-ChoiceTextEntryValue]. - It is likely that I will date someone other than  [QID133-ChoiceTextEntryValue] within the next year.","For each of the following statements, select the option that best describes your dating relationship with [QID133-ChoiceTextEntryValue]. - I feel very attached to our relationship- strongly linked to my partner.","For each of the following statements, select the option that best describes your dating relationship with [QID133-ChoiceTextEntryValue]. - I want our relationship to last forever.","For each of the following statements, select the option that best describes your dating relationship with [QID133-ChoiceTextEntryValue]. - I am oriented toward the long-term future of my relationship (for example, I imagine being with my partner several years from now).","For each of the following statements, select the option that best describes your dating relationship with [QID133-ChoiceTextEntryValue]. - [QID133-ChoiceTextEntryValue] has put a great deal into our relationship that he/she would lose if the relationship were to end.","For each of the following statements, select the option that best describes your dating relationship with [QID133-ChoiceTextEntryValue]. - Many aspects of [QID133-ChoiceTextEntryValue]’s life have become linked to my own (recreational activities, etc.) and he/she would lose all of this if we were to break up.","For each of the following statements, select the option that best describes your dating relationship with [QID133-ChoiceTextEntryValue]. - [QID133-ChoiceTextEntryValue] is very involved in our relationship.","For each of the following statements, select the option that best describes your dating relationship with [QID133-ChoiceTextEntryValue]. - [QID133-ChoiceTextEntryValue]'s relationships with his/her friends and family members would be complicated if we were I were to break up (e.g. I am friends with people my partner cares about).","For each of the following statements, select the option that best describes your dating relationship with [QID133-ChoiceTextEntryValue]. - Compared to other partners I know, [QID133-ChoiceTextEntryValue] has invested a great deal in his/her relationship with me.","For each of the following statements, select the option that best describes your dating relationship with [QID133-ChoiceTextEntryValue]. - [QID133-ChoiceTextEntryValue] is committed to maintaining our relationship.","For each of the following statements, select the option that best describes your dating relationship with [QID133-ChoiceTextEntryValue]. - [QID133-ChoiceTextEntryValue] intends to stay in this relationship.","For each of the following statements, select the option that best describes your dating relationship with [QID133-ChoiceTextEntryValue]. - [QID133-ChoiceTextEntryValue] feels very attached to our relationship -- strongly linked to me.","For each of the following statements, select the option that best describes your dating relationship with [QID133-ChoiceTextEntryValue]. - [QID133-ChoiceTextEntryValue] is oriented toward the long-term future of our relationship (for example, imagines being with me several years from now).",What is your age?,The age of [QID133-ChoiceTextEntryValue]?,What is your gender?,What is [QID133-ChoiceTextEntryValue]'s gender?,How sexually exclusive is your relationship with [QID133-ChoiceTextEntryValue]?,How emotionally exclusive is your relationship with [QID133-ChoiceTextEntryValue]?,Do you have an Instagram account?,"Our lab is interested in how social media
plays a role in people’s dating experiences. With your permission, we would
like to follow you on Instagram from our lab account, “Relationship Decisions”.
Your Instagram data would be used for research purposes only, and would never
be shared outside of our research team. 
Are you comfortable allowing our lab’s
Instagram account to follow yours? If not, that’s completely okay—declining
will not affect your involvement in the study in any way. - Selected Choice","Our lab is interested in how social media
plays a role in people’s dating experiences. With your permission, we would
like to follow you on Instagram from our lab account, “Relationship Decisions”.
Your Instagram data would be used for research purposes only, and would never
be shared outside of our research team. 
Are you comfortable allowing our lab’s
Instagram account to follow yours? If not, that’s completely okay—declining
will not affect your involvement in the study in any way. - Yes, you may follow me on Instagram for research purposes. My Instagram handle is: - Text",What is your race?,What is your nationality?,Are you a native English speaker?,What is your religious affiliation? - Selected Choice,What is your religious affiliation? - Other (please specify): - Text,How would you describe your religious involvement?,How would you describe your political involvement?,What is your highest level of education?,Do you have any children?,How many children do you have?,Are your parents divorced?,What is the highest education level achieved by your mother?,What is the highest education level achieved by your father?,What is your mother's occupation?,What is your father's occupation?,"IMPORTANT! Please answer honestly: it is extremely important for our research. Your compensation will NOT be affected by your response.
Which of the following best represents how you approached this survey?",Do you have any other comments you would like to leave for the researchers?,"Sometimes people begin participating a study, and then find that they do not actually meet the criteria for the study. That is okay, but it is important for us to know as it may affect our results. Please be truthful: are you currently in a new dating relationship? You will be entered into the gift card draw for this survey regardless of your response. - Selected Choice","Sometimes people begin participating a study, and then find that they do not actually meet the criteria for the study. That is okay, but it is important for us to know as it may affect our results. Please be truthful: are you currently in a new dating relationship? You will be entered into the gift card draw for this survey regardless of your response. - I am in a dating relationship, but it began more than four weeks ago (please enter how many weeks ago your first date was). - Text",Race - Topics
